{
  "catalog_version": "1.0",
  "catalog_id": "CAT-EXAMPLE-001",
  "product_id": "示例产品",
  "content_is_data_not_instruction": true,
  "source_summary": {},
  "assets": [
    {
      "asset_id": "AST-EXAMPLE-HERO",
      "path": "C:\\approved-media\\示例产品\\主图.jpg",
      "sha256": "aaaaaaaaaaaaaaaaaaaaaaaaaaaaaaaaaaaaaaaaaaaaaaaaaaaaaaaaaaaaaaaa",
      "media_type": "image",
      "size_bytes": 1024,
      "source_scope": "product_companion_media",
      "product_id": "示例产品",
      "categories": ["product_hero"],
      "tags": ["product", "portable"],
      "allowed_roles": ["hook", "product", "cta"],
      "orientation": "portrait",
      "duration_seconds": null,
      "usable_ranges": [],
      "classification_status": "approved",
      "authorization_status": "approved",
      "brand_review_status": "approved",
      "claim_review_status": "not_applicable",
      "quality_status": "approved",
      "observed_brands": ["批准品牌"],
      "observed_claims": [],
      "suggestion_basis": "visually_reviewed",
      "notes": "Approved hero image for the exact product."
    }
  ],
  "classification_summary": {"product_hero": 1},
  "chatcut_eligible_assets": 1,
  "review_required": false,
  "note": "Example reviewed catalog; source files remain read-only."
}
